{
  "signature_id": "tst:signature:referencecity.authority-0001",
  "key_id": "tst:key:org.referencecity.planning-bureau.2026-01",
  "signer_actor_id": "tst:actor:org.referencecity.planning-bureau",
  "algorithm": "ed25519",
  "canonicalization": "TST-C14N-JSON/0.1",
  "payload_digest": {
    "algorithm": "sha256",
    "digest": "fa2fb87e35918613e82d1ec74ab47f456d8952f434abc20e09ff76b93ab7be26"
  },
  "signature": "5Q4PBEaOhlaL6I9kAP1-2wCoz2ykRM6sys-Z_qn7x5gTHSW_ayV13SwZWadAfO9oJl2DcTbrCRO1_KRXJm_4Aw",
  "created_at": "2026-01-02T00:00:02Z",
  "schema_version": "0.2"
}
