{
  "signature_id": "tst:signature:referencecity.credential-old-key",
  "key_id": "tst:key:org.referencecity.planning-bureau.2025-01",
  "algorithm": "ed25519",
  "canonicalization": "TST-C14N-JSON/0.1",
  "payload_digest": {
    "algorithm": "sha256",
    "digest": "36dcfcee01027ab9443d71fbc24282d98eec55d1226c195d3a91a74cba3edd7e"
  },
  "signature": "sS0kkNnvTgnDYAQC3NEYN0HN93e6-kY2OKZoahejueFtYd_L1yMQcgr6Emb7keoH7OjiKrRfWWNDUv5vffljAA",
  "created_at": "2025-12-21T00:00:00Z",
  "schema_version": "0.2",
  "signer_actor_id": "tst:actor:org.referencecity.planning-bureau"
}
