{
  "signature_id": "tst:signature:referencecity.credential-0001",
  "key_id": "tst:key:org.referencecity.planning-bureau.2026-01",
  "algorithm": "ed25519",
  "canonicalization": "TST-C14N-JSON/0.1",
  "payload_digest": {
    "algorithm": "sha256",
    "digest": "36dcfcee01027ab9443d71fbc24282d98eec55d1226c195d3a91a74cba3edd7e"
  },
  "signature": "XC-MquF--mWHyBZH1wWSKX5hxT8IxNiYcbYZmJnFZ4vucPigJztXbvkgo8e7lKc8W6WUIJ4SDY3ZQ1OlVY_SBA",
  "created_at": "2026-01-02T00:00:01Z",
  "schema_version": "0.2",
  "signer_actor_id": "tst:actor:org.referencecity.planning-bureau"
}
